{
  "schemaVersion": "1",
  "kind": "sparse-experiment-resource-observations/v1",
  "corpusManifestSha256": "2f0d9e6cfd8eca2527e095389a0cc66cc81bf697eeed804a91798141ad9494ef",
  "implementationManifestSha256": "9cf28a92a4ba1c915029c096441c6066496b555fed715b7fcae092c82a086c90",
  "cells": [
    {
      "operatingSystem": "ubuntu",
      "findingCount": 1000,
      "dataset": "unique",
      "candidateEdges": 1000,
      "observedMaximumComponentFindingCount": 2,
      "maximumAdmittedAssignmentComponentSize": 2,
      "configuredCandidatePairsPerFindingLimit": 256,
      "configuredCandidatePairLimit": 1000000,
      "configuredAssignmentComponentLimit": 12,
      "boundedRefusalObserved": false,
      "runtimeBudgetEnforced": true,
      "withinDocumentedLimits": true
    },
    {
      "operatingSystem": "ubuntu",
      "findingCount": 1000,
      "dataset": "pathological",
      "candidateEdges": 0,
      "observedMaximumComponentFindingCount": 2000,
      "maximumAdmittedAssignmentComponentSize": 0,
      "configuredCandidatePairsPerFindingLimit": 256,
      "configuredCandidatePairLimit": 1000000,
      "configuredAssignmentComponentLimit": 12,
      "boundedRefusalObserved": true,
      "runtimeBudgetEnforced": true,
      "withinDocumentedLimits": true
    },
    {
      "operatingSystem": "ubuntu",
      "findingCount": 10000,
      "dataset": "unique",
      "candidateEdges": 10000,
      "observedMaximumComponentFindingCount": 2,
      "maximumAdmittedAssignmentComponentSize": 2,
      "configuredCandidatePairsPerFindingLimit": 256,
      "configuredCandidatePairLimit": 1000000,
      "configuredAssignmentComponentLimit": 12,
      "boundedRefusalObserved": false,
      "runtimeBudgetEnforced": true,
      "withinDocumentedLimits": true
    },
    {
      "operatingSystem": "ubuntu",
      "findingCount": 10000,
      "dataset": "pathological",
      "candidateEdges": 0,
      "observedMaximumComponentFindingCount": 20000,
      "maximumAdmittedAssignmentComponentSize": 0,
      "configuredCandidatePairsPerFindingLimit": 256,
      "configuredCandidatePairLimit": 1000000,
      "configuredAssignmentComponentLimit": 12,
      "boundedRefusalObserved": true,
      "runtimeBudgetEnforced": true,
      "withinDocumentedLimits": true
    },
    {
      "operatingSystem": "ubuntu",
      "findingCount": 100000,
      "dataset": "unique",
      "candidateEdges": 100000,
      "observedMaximumComponentFindingCount": 2,
      "maximumAdmittedAssignmentComponentSize": 2,
      "configuredCandidatePairsPerFindingLimit": 256,
      "configuredCandidatePairLimit": 1000000,
      "configuredAssignmentComponentLimit": 12,
      "boundedRefusalObserved": false,
      "runtimeBudgetEnforced": true,
      "withinDocumentedLimits": true
    },
    {
      "operatingSystem": "ubuntu",
      "findingCount": 100000,
      "dataset": "pathological",
      "candidateEdges": 0,
      "observedMaximumComponentFindingCount": 200000,
      "maximumAdmittedAssignmentComponentSize": 0,
      "configuredCandidatePairsPerFindingLimit": 256,
      "configuredCandidatePairLimit": 1000000,
      "configuredAssignmentComponentLimit": 12,
      "boundedRefusalObserved": true,
      "runtimeBudgetEnforced": true,
      "withinDocumentedLimits": true
    },
    {
      "operatingSystem": "windows",
      "findingCount": 1000,
      "dataset": "unique",
      "candidateEdges": 1000,
      "observedMaximumComponentFindingCount": 2,
      "maximumAdmittedAssignmentComponentSize": 2,
      "configuredCandidatePairsPerFindingLimit": 256,
      "configuredCandidatePairLimit": 1000000,
      "configuredAssignmentComponentLimit": 12,
      "boundedRefusalObserved": false,
      "runtimeBudgetEnforced": false,
      "withinDocumentedLimits": true
    },
    {
      "operatingSystem": "windows",
      "findingCount": 1000,
      "dataset": "pathological",
      "candidateEdges": 0,
      "observedMaximumComponentFindingCount": 2000,
      "maximumAdmittedAssignmentComponentSize": 0,
      "configuredCandidatePairsPerFindingLimit": 256,
      "configuredCandidatePairLimit": 1000000,
      "configuredAssignmentComponentLimit": 12,
      "boundedRefusalObserved": true,
      "runtimeBudgetEnforced": false,
      "withinDocumentedLimits": true
    },
    {
      "operatingSystem": "windows",
      "findingCount": 10000,
      "dataset": "unique",
      "candidateEdges": 10000,
      "observedMaximumComponentFindingCount": 2,
      "maximumAdmittedAssignmentComponentSize": 2,
      "configuredCandidatePairsPerFindingLimit": 256,
      "configuredCandidatePairLimit": 1000000,
      "configuredAssignmentComponentLimit": 12,
      "boundedRefusalObserved": false,
      "runtimeBudgetEnforced": false,
      "withinDocumentedLimits": true
    },
    {
      "operatingSystem": "windows",
      "findingCount": 10000,
      "dataset": "pathological",
      "candidateEdges": 0,
      "observedMaximumComponentFindingCount": 20000,
      "maximumAdmittedAssignmentComponentSize": 0,
      "configuredCandidatePairsPerFindingLimit": 256,
      "configuredCandidatePairLimit": 1000000,
      "configuredAssignmentComponentLimit": 12,
      "boundedRefusalObserved": true,
      "runtimeBudgetEnforced": false,
      "withinDocumentedLimits": true
    },
    {
      "operatingSystem": "windows",
      "findingCount": 100000,
      "dataset": "unique",
      "candidateEdges": 100000,
      "observedMaximumComponentFindingCount": 2,
      "maximumAdmittedAssignmentComponentSize": 2,
      "configuredCandidatePairsPerFindingLimit": 256,
      "configuredCandidatePairLimit": 1000000,
      "configuredAssignmentComponentLimit": 12,
      "boundedRefusalObserved": false,
      "runtimeBudgetEnforced": false,
      "withinDocumentedLimits": true
    },
    {
      "operatingSystem": "windows",
      "findingCount": 100000,
      "dataset": "pathological",
      "candidateEdges": 0,
      "observedMaximumComponentFindingCount": 200000,
      "maximumAdmittedAssignmentComponentSize": 0,
      "configuredCandidatePairsPerFindingLimit": 256,
      "configuredCandidatePairLimit": 1000000,
      "configuredAssignmentComponentLimit": 12,
      "boundedRefusalObserved": true,
      "runtimeBudgetEnforced": false,
      "withinDocumentedLimits": true
    }
  ]
}
